{
  "artifactId": "site-docs",
  "bundleBytes": 16833,
  "bundleHash": "sha256:fa1962f76f2e656b9a332548a53376be1159c88ded8e4fa949fb3542922a26a9",
  "bundlePath": ".styleseed/bundles/site-docs.md",
  "gates": {
    "code": {
      "attached": false,
      "reportBytes": null,
      "reportPath": null,
      "reportSha256": null
    },
    "deterministic": {
      "attached": true,
      "reportPath": ".styleseed/evidence/site-docs/baseline-f5ff2b5/deterministic.json",
      "reportSha256": "sha256:20821e2582fa30bce360bc6c46fe5921f6828fdd6ecb11799e71c37959e37aa1",
      "reportBytes": 1086
    },
    "human": {
      "attached": false,
      "reportBytes": null,
      "reportPath": null,
      "reportSha256": null
    },
    "temporal": {
      "attached": false,
      "reportBytes": null,
      "reportPath": null,
      "reportSha256": null
    },
    "visual": {
      "attached": false,
      "reportBytes": null,
      "reportPath": null,
      "reportSha256": null
    }
  },
  "implementation": {
    "inventoryHash": "sha256:a1193b3f09852edd3712aa9b3bacef9d245ec0cbadb97eef9f4de28defa8ac7a",
    "sourceRoots": [
      "demo-pricing/app/architecture",
      "demo-pricing/app/guides",
      "demo-pricing/app/globals.css"
    ]
  },
  "manifestPath": ".styleseed/manifests/site-docs.json",
  "methodHash": "sha256:3b85de8475bbf990f49b17da4ef58a06cfb37d3126657035b8f4d60548ffecb7",
  "runId": "baseline-f5ff2b5",
  "schemaVersion": 1,
  "validationHash": "sha256:58f1e9b237d636028d6e79a54d842f0b73be8605f4aa387278a4cc8793ac45cd"
}
