{
  "artifactId": "site-home",
  "bundleBytes": 18481,
  "bundleHash": "sha256:63d45e689a5884897dcca3713b6ab24e9de88cda4f36ae97d02386375f3462bb",
  "bundlePath": ".styleseed/bundles/site-home.md",
  "gates": {
    "code": {
      "attached": false,
      "reportBytes": null,
      "reportPath": null,
      "reportSha256": null
    },
    "deterministic": {
      "attached": true,
      "reportPath": ".styleseed/evidence/site-home/baseline-f5ff2b5/deterministic.json",
      "reportSha256": "sha256:9300bbd4c23b31ee1d69efed31612545248e25b10bc21ece3fb4079133aa9a49",
      "reportBytes": 8855
    },
    "human": {
      "attached": false,
      "reportBytes": null,
      "reportPath": null,
      "reportSha256": null
    },
    "temporal": {
      "attached": false,
      "reportBytes": null,
      "reportPath": null,
      "reportSha256": null
    },
    "visual": {
      "attached": false,
      "reportBytes": null,
      "reportPath": null,
      "reportSha256": null
    }
  },
  "implementation": {
    "inventoryHash": "sha256:de429764824d2538e11c744e1a0432dfabc5b15f19442c734a49cead8515ccbb",
    "sourceRoots": [
      "demo-pricing/app/page.tsx",
      "demo-pricing/app/_home",
      "demo-pricing/app/globals.css"
    ]
  },
  "manifestPath": ".styleseed/manifests/site-home.json",
  "methodHash": "sha256:7118dddce1e2851c88c981a7b0214953a7c929e973889837eeafa8ed08373394",
  "runId": "baseline-f5ff2b5",
  "schemaVersion": 1,
  "validationHash": "sha256:7cbfc1600d5c86ee87f2fb9225ee8fbe8d62a43364f1fa51453949ff382fdae1"
}
