{
  "artifactId": "site-gate",
  "bundleBytes": 16799,
  "bundleHash": "sha256:2f3eef3191895ecdf5a6b15f81bd86ab90a767413233813a60b94a181cf80175",
  "bundlePath": ".styleseed/bundles/site-gate.md",
  "gates": {
    "code": {
      "attached": false,
      "reportBytes": null,
      "reportPath": null,
      "reportSha256": null
    },
    "deterministic": {
      "attached": true,
      "reportPath": ".styleseed/evidence/site-gate/baseline-f5ff2b5/deterministic.json",
      "reportSha256": "sha256:63ced18c1a8f3cb78967201bed188f24fbb895cc513b5686135a5344d323fe99",
      "reportBytes": 1674
    },
    "human": {
      "attached": false,
      "reportBytes": null,
      "reportPath": null,
      "reportSha256": null
    },
    "temporal": {
      "attached": false,
      "reportBytes": null,
      "reportPath": null,
      "reportSha256": null
    },
    "visual": {
      "attached": false,
      "reportBytes": null,
      "reportPath": null,
      "reportSha256": null
    }
  },
  "implementation": {
    "inventoryHash": "sha256:b5808ce7b259cd1dfee0083296f6d0e6ed14b54ea0edbfd129945c233c373c05",
    "sourceRoots": [
      "demo-pricing/app/gate",
      "demo-pricing/app/globals.css"
    ]
  },
  "manifestPath": ".styleseed/manifests/site-gate.json",
  "methodHash": "sha256:07ec651169265a5a55a52cd5db02e595b766f1f9ba81dd25bbb7d54bf6d22d38",
  "runId": "baseline-f5ff2b5",
  "schemaVersion": 1,
  "validationHash": "sha256:3462a1922e141bcb82dfd875e886dc8aae43a995ce0bc7958705594a9cf20e0c"
}
